{
  "schema_version": "1.0.0",
  "event_id": "obs-cr-cancelled-1",
  "patient_id": "Patient/bridge-demo-1",
  "encounter_id": "Encounter/enc-bridge-1",
  "resource_type": "Observation",
  "resource": {
    "resourceType": "Observation",
    "id": "cr-2",
    "status": "cancelled",
    "code": { "text": "Creatinine" }
  },
  "clinical_event_time": "2026-08-12T10:00:00Z",
  "availability_time": "2026-08-12T10:04:00Z",
  "trust_status": "trusted",
  "source": {
    "system": "hospital-a-lab",
    "resource_id": "Observation/cr-2",
    "spans": []
  },
  "extraction": {
    "method": "deterministic",
    "model": null,
    "prompt_version": null,
    "confidence": null
  },
  "validation": {
    "schema": "passed",
    "terminology": "passed",
    "provenance": "passed",
    "semantic_review": "not_required"
  },
  "idempotency_key": "hospital-a-lab:Observation/cr-2:cancel:sha256:ghi",
  "extensions": {
    "cancelled": true
  }
}
